Titre de l'opération,Thématique
+ de nature en ville / Ruchers; appel à projets / Parc Montsouris,Environnement
Rénovation de la fontaine Niki de Saint Phalle,Culture et patrimoine
Une nouvelle halle alimentaire dans le 15e,Solidarités
Sport en plein air,Sport
Rénovation les toilettes de l'école Enfants d'Izieu,Education et jeunesse
Fresque mur Paris Habitat - Goutte d'Or,Cadre de vie
Affichage associatif,Solidarités
EPJ Flandre,Education et jeunesse
Création d'un lieu dédié à l'e-sport,Sport
Un verger et des bacs de culture dans le 19e / verger rue de Romainville,Environnement
CS Château-des-Rentiers,Cadre de vie
Ens. Sup. Campus des Cordeliers,Environnement
Cultiver dans les écoles / Ecole 2/18,Education et jeunesse
Cultiver dans les écoles / Ecole 11/18,Education et jeunesse
Cultiver dans les écoles / Ecole 15/17,Education et jeunesse
Cultiver dans les écoles / Ecole 5/12,Education et jeunesse
Cultiver dans les écoles / Ecole 4/23,Education et jeunesse
Cultiver dans les écoles / Ecole 15/23,Education et jeunesse
Cultiver dans les écoles / Ecole 20/23,Education et jeunesse
Cultiver dans les écoles / Ecole 2/11,Education et jeunesse
Cultiver dans les écoles / Ecole 23/30,Education et jeunesse
Cultiver dans les écoles / Ecole 16/21,Education et jeunesse
Cultiver dans les écoles / Ecole 1/18,Education et jeunesse
Cultiver dans les écoles / Ecole 4/18,Education et jeunesse
Cultiver dans les écoles / Ecole 17/18,Education et jeunesse
Du matériel de nettoiement silencieux et non polluant Aspirateur Glutton 020 2,Propreté
matériel de nettoiement silencieux et non polluant Souffleuses électriques 021 29,Propreté
matériel de nettoiement silencieux et non polluant Souffleuses électriques 021 51,Propreté
matériel de nettoiement silencieux et non polluant Souffleuses électriques 021 76,Propreté
matériel de nettoiement silencieux et non polluant Souffleuses électriques 021 82,Propreté
matériel de nettoiement silencieux et non polluant Souffleuses électriques 021 100,Propreté
matériel de nettoiement silencieux et non polluant Souffleuses électriques 021 106,Propreté
matériel de nettoiement silencieux et non polluant Batterie Souffleuses électriques 6,Propreté
Du matériel de nettoiement silencieux et non polluant débroussailleuses électriques 023 5,Propreté
Du matériel de nettoiement silencieux et non polluant débroussailleuses électriques 023 10,Propreté
Du matériel de nettoiement silencieux et non polluant Micro Aspiratrice de trottoir 024 4,Propreté
CHAMPIONNET (7) ELEM,Education et jeunesse
MONT CENIS (26) ELEM,Education et jeunesse
PHILIPPE DE GIRARD (58) ELEM,Education et jeunesse
Collège Moulin des prés,Education et jeunesse
école élémentaire 51 porte d'Ivry,Education et jeunesse
Toilettes Ecole élémentaire Boy zelenski,Education et jeunesse
Les radeaux végétalisés,Environnement
Ecole élémentaire Porte Brancion,Education et jeunesse
Collège Françoise Dolto,Education et jeunesse
kiosque citoyen place Félix Eboué,Solidarités
Des espaces ludiques dans toutes les écoles du XXème,Education et jeunesse
Des espaces ludiques dans toutes les écoles du XXème,Education et jeunesse
Des espaces ludiques dans toutes les écoles du XXème,Education et jeunesse
La Boîte à Jouer-option jeux d'exterieurs,Education et jeunesse
La boite à jouer,Education et jeunesse
La boite à jouer,Education et jeunesse
Projet OASIS école Merlin,Environnement
Projet OASIS école Colonel Moll,Environnement
L'ORILLON,Attractivité et emploi
Projet OASIS école Chapelle Internationale,Environnement
Projet OASIS Ecole Rampal,Environnement
Projet OASIS école Ourcq,Environnement
Atelier mutualisé PTCE Goutte d'Or,Solidarités
Cultiver dans la crèche Prêtres Saint Séverin,Environnement
Cultiver dans la crèche Saint-Maur,Environnement
Cultiver dans la crèche Duméril,Environnement
Cultiver dans la crèche Maindron,Environnement
Cultiver dans le jardin d'enfant Châtillon,Environnement
Cultiver dans la crèche Rouen,Environnement
Cultiver dans la crèche Nantes,Environnement
Cultiver dans la crèche Lepage,Environnement
Des jardins sur les murs / 75009 - mur végétalisé Jean-Baptiste Pigalle,Environnement
C- SUIV 003688 - + de nature en ville / 04-Mares et espaces de biodiversité/ Bois de Vincennes avenue du Polygone,Environnement
+ de nature en ville / 04-Mares et espaces de biodiversité/ place jean-baptiste Clément,Environnement
Agrandissement de la bibliothèque Charlotte Delbo,Culture et patrimoine
ACTU X0 (l'Archipel Civic Tech Urbaine X.0),Solidarités
Street basket à Auteuil Sud,Sport
Aidons les associations de la solidarité à mieux accueillir les personnes à la rue,Solidarités
Fresque Hopital Saint-Louis,Cadre de vie
Création d'un poulailler 11 rue de la Mare,Environnement
VOILES POUR PROTECTION SOLEIL ET PLUIE DANS LA COUR ECOLES,Education et jeunesse
Solaire/Végétal sur les toits des établissements scolaires,Environnement
+ d’arceaux à vélos dans le 18e : favorisons les mobilités douces,Mobilités
Restauration de la flèche,Culture et patrimoine
Végétalisation de la rue de la santé,Environnement
Peinture artistique des grilles du square Jules verne,Culture et patrimoine
Action 1 : installation de panneaux solaires - collège André Citroën (15e),Environnement
#SousLesPavésDesFleurs / Du gazon sur les trottoirs / Débitumage - Végétaliser les trottoirs du boulevard Diderot et remplacer les zones sablonneuses par de la pelouse ou des fleurs,Environnement
Fresque au 156 rue Saussure,Culture et patrimoine
Equiper les associations du 11e : Tatane,Solidarités
Essaimage des repair café à Paris (4/10),Solidarités
Essaimage des repair café à Paris (10/10),Solidarités
Embellissons les écoles de nos quartiers-école Aubervilliers,Education et jeunesse
Des cantines plus agréables EM 40 rue Vandrezanne,Education et jeunesse
Des sanitaires neufs pour l'EE Barbanègre,Education et jeunesse
Maison Bakhita,Solidarités
Compléter et moderniser le matériel des écoles du 19e,Education et jeunesse
Des cantines rénovées et insonorisées pour les écoles EM rue Meuniers,Education et jeunesse
Plus d'équipements dans nos écoles EM Cepré,Education et jeunesse
Espaces Ludiques dans les écoles du 16e,Education et jeunesse
Espaces Ludiques dans les écoles du 16e,Education et jeunesse
Equipement de jeux de cour dans les cours d'école,Education et jeunesse
Equipement de jeux de cour dans les cours d'école,Education et jeunesse
BOUCHERIE DU GRAND MARCHE,Attractivité et emploi
Plus d'équipements dans nos écoles/ dotation VPI,Education et jeunesse
Plus d'équipements dans nos écoles/ dotation VPI,Education et jeunesse
Action 2 : installation de panneaux photovoltaïques - rue des Partants,Environnement
"Des ordis, pas des tablettes, pour les écoles du 12eme",Education et jeunesse
Solaire/Végétal sur les toits des établissements scolaires,Environnement
Végétalisation de la rue Cyrano de Bergerac,Environnement
Recharge téléphonique pour les sans-abris,Solidarités
"Une piscine plus grande, pour tous, à la Butte-aux-Cailles",Sport
Pavillon Carré de Baudouin,Environnement
Collège Octave Gréard - Un mur d'escalade,Sport
Aménager une cuisine citoyenne quartier porte d’orléans,Solidarités
Créer des lieux de partage autour de la cuisine,Solidarités
"Agriculture urbaine, jardin à but productif collectifs",Solidarités
EM Romainville -  Poursuite de la réhabilitation du préau,Education et jeunesse
EM Rampal - Rénovation des sanitaires de l'étage et du rdc,Education et jeunesse
Création d'un barrage à bulles,Propreté
Equipement numérique pour femmes sortant de prison,Solidarités
Rue Dieu,Cadre de vie
Embellir et végétaliser le square Marcel Rajman (rue Merlin),Environnement
Remplacer et rénover les bancs de Paris Centre,Cadre de vie
Réhabilitation d'un pavillon de garde du Bois de Boulogne,Cadre de vie
Prévention du bruit dans les écoles,Education et jeunesse
Rénover le GS EE Fourcroy et l'EM Renaudes,Education et jeunesse
Un lieu de rencontre ouvert et inclusif à Rosa Parks,Solidarités
2 bornes électriques pour les animations rue Paradol,Solidarités
"Paris, source de fraicheur - 01 - Fontaine n°2",Environnement
"Rénovation locaux et achat matériels Aux captifs, la libération",Solidarités
Aménager le square saint-laurent,Environnement
Aire de jeux inclusive square Yvette Chauviré,Environnement
EM Elisa Lemonnier,Education et jeunesse
Des équipements techniques et pédagogiques pour la MBB,Education et jeunesse
"Coup de main, Saint-Blaise fait sa mue",Attractivité et emploi
Se rafraîchir à Paris,Cadre de vie
01-Aménagement d’un espace de jardinage et d'une scène d'art paysager dans le square Honoré Champion,Environnement
Travaux de toiture,Culture et patrimoine
07-Sécuriser le carrefour rue Sedaine / Saint-Sabin,Cadre de vie
03-Développer des îlots de fraicheur dans plusieurs espaces verts du 15ème,Environnement
04-Des tables de ping-pong plus nombreuses et plus belles dans le square Maurice Gardette,Environnement
07-Nouveaux nichoirs pour préserver les oiseaux dans le 11ème,Environnement
une école inclusive -Aménagements d'espaces EE G.Archimède,Education et jeunesse
03-Kits d'arrosage à l'eau non potable,Environnement
Crèche municipale Ménilmontant,Education et jeunesse
Des activités pour les jeunes enfants de l’arrondissement,Education et jeunesse
De nouveaux matériels pour la Ludomouv',Solidarités
Rénovation des infrastructures de rugby,Sport
Couverture des Tennis Mourlon,Sport
Cycle-Up - Nouveaux ateliers,Solidarités
Lutter contre le réchauffement climatique - des panneaux photovoltaïques sur les toits,Environnement
Du numérique au CDL Brancion,Culture et patrimoine
Sauvegarde des statues du 7e arrondissement,Culture et patrimoine
Faire évoluer les usages de la place Maxime Lisbonne,Cadre de vie
Installation de dispositifs sur l’espace public pour permettre aux habitants d’y déposer leurs déchets alimentaires en apport volontaire,Propreté
EE Belleville : réaménagement sportif du rez-de-chaussée pour les élèves et les escrimeurs !,Education et jeunesse
Végétaliser les cours de récréation des écoles/ EE 99 Pelleport,Education et jeunesse
Babyfoot pour la bibliothèque Assia Djebar,Culture et patrimoine
Street workout et jeux pour enfants boulevard de Grenelle,Sport
Un véhicule électrique pour la Maison du Bas Belleville et le Picoulet,Solidarités
Pour une crèche verte et propre,Solidarités
Achat de matériel sportif pour l'association Aurore Itinérances,Solidarités
mur peint façade conservatoire,Culture et patrimoine
Compagnons bâtisseurs - travaux de l'entrepôt réemploi et acquisition d'équipements,Propreté
Créer une zone de rencontre boulevard de Port-Royal,Cadre de vie
Sécurisation de la piste cyclable quai de Valmy,Mobilités
Rendre la place Henri Frenay aux enfants,Cadre de vie
Aménagements cyclables et bus pour la rue Bobillot,Mobilités
Travaux bibliothèque Valeyre,Culture et patrimoine
Une coulée verte sur la rue Sorbier et la Petite Ceinture,Environnement
Bricothèque - Emprunt d'outils et bricolage (Régie de quartier Centre),Solidarités
Cirque électrique,Culture et patrimoine
Insonorisation de l’école Victor Cousin,Education et jeunesse
DANSER SUR DES QUAIS RENOVES,Cadre de vie
Jardin partagé du 20 rue Ortolan - budget complémentaire pour la la réfection d'un escalier de secours et la création d'un nouvel escalier pour l'accès au jardin,Environnement
Bacs végétalisés,Cadre de vie
"Le potager Valeyre, agrandi et partagé",Cadre de vie
"Parvis St-Nicolas-des-Champs : Un lieu apaisé, convivial et vert",Cadre de vie
Lecture et végétalisation Carreau du temple,Culture et patrimoine
Lieu dédié au bricolage participatif,Solidarités
Réaménagement de la place Cambronne et de ses abords,Cadre de vie
Mise en valeur de l'église Saint-Ambroise,Culture et patrimoine
Collège André Citroen - toit 1 - 208 rue saint charles 15e,Environnement
"Promenade Péreire - Laugier / Bayen, Kiosque à musique",Cadre de vie
"Square place de Bitche, Kiosque à musique",Cadre de vie
Vacherie anglaise Jardin des Champs-Elysées,Cadre de vie
Végétalisation des murs et des rues du 14e arrondissement / végétalisation des pieds d'arbres de la rue d'Alesia,Environnement
Végétalisation des murs et des rues du 14e arrondissement / renforcement de la végétalisation sur trottoirs de l'avenue de la porte de Chatillon,Environnement
Plus de Vert à Montmartre ! / 02- Végétalisation du 19 rue de Clignancourt,Cadre de vie
Des jardins sur les murs / 75002 - mur végétalisé Placette des petits carreaux (n°45) - 43 rue des petits carreaux,Environnement
Des jardins sur les murs / 75011 - mur végétalisé Rue Omer Talon,Environnement
Des jardins sur les murs / 75012 - mur végétalisé 8 AVENUE LAMORICIERE,Environnement
Des jardins sur les murs / 75013 - mur végétalisé 28 boulevard Kellermann,Environnement
Végétaliser les murs et les toits dans le 15ème / 04 - bibliotheque Gutenberg,Cadre de vie
"Restauration fresque ""L'ombre de l'arbre"" Tamas Zanko",Culture et patrimoine
"Square Jean Aicard; ""le square fait vivre ! (ensemble)",Cadre de vie
Conservatoire municipal du 13e arrondissement,Culture et patrimoine
Conciergerie solidaire,Solidarités
Une rue de Richelieu réaménagée et sécurisée,Prévention et sécurité
Bricothèque de la Régie de quartier Tela 13,Solidarités
Réhabilitation du passage voute sous le métro Corvisart,Propreté
SAUVEGARDE Fontaine FELLAH,Cadre de vie
MONTMARTRE ACCESSIBLE A TOUS - PHASE 2,Mobilités
Sanitaires école élémentaire CHEMINETS,Education et jeunesse
Rénovation crèche CHRS Charonne,Solidarités
Lauréat Coup de Pouce Commerce: TERROIR ET COMPAGNIE,Attractivité et emploi
F.Tree (restauration traditionnelle),Attractivité et emploi
Hôtel insectes Square Boucicaut,Environnement
Hôtel insectes Jardin Catherine Labouré,Environnement
Outils numériques école élémentaire VICTOIRE,Education et jeunesse
Sanitaires école élémentaire PICPUS B,Education et jeunesse
Sanitaires école élémentaire REUILLY B,Education et jeunesse
Sanitaires école élémentaire PICPUS A,Education et jeunesse
Sanitaires école élémentaire et maternelle 46 JENNER,Education et jeunesse
VPI école maternelle PORTE BRANCION,Education et jeunesse
VPI école élémentaire SAINT LAMBERT,Education et jeunesse
Création d’une trame verte - Rénovation grille square Adolphe Chérioux,Cadre de vie
Les Confitures antigaspi Re-Belle,Solidarités
Les Restaurants du Coeur de Paris - Les Relais du Coeur de Paris,Solidarités
Amélioration du matériel des CS du 5è_Gym. L. Gaudin,Sport
LAI Michaux,Cadre de vie
Gymn. Saussure,Santé
Tennis d'Asnuères,Santé
CS Carpentier,Cadre de vie
SWO Sq. Monnerville,Sport
escalade parc Brassens,Sport
Fitness Jardin Pierre Seghers,Sport
Colonnes à verre enterrée - 12 rue des Portes Blanches (18e),Propreté
Les terre-pleins des boulevards des Fermiers Généraux  (11e & 20e arrondissements),Cadre de vie
Des fontaines à boire dans tout Paris Fontaine Pétillante,Cadre de vie
EP LANCRY,Education et jeunesse
Rue aux enfants - Rue Général Renault (11e),Cadre de vie
Rue aux enfants - Rue Buzenval 20e,Cadre de vie
Femmes de la Terre,Solidarités
Projet de signalétique Porte de Vanves,Solidarités
Les Petits riens,Solidarités
Lateulier,Solidarités
Restaurant Commun l'Oratoire,Solidarités
#SousLesPavésDesFleurs / jardinières rue Dalayrac,Environnement
TEP Gare de Charonne,Sport
+ de nature en ville / Ruchers; appel à projets / Square Louis Majorelle,Environnement
Moderniser l'éclairage sous le pont à la sortie du métro,Cadre de vie
Rampe d'accessibilité à l'église St-Michel-des-Batignolles,Solidarités
Ferme urbaine sur toit,Education et jeunesse
Prévention de la canicule pour les personnes âgées,Solidarités
Hôtel Beaujon / Bacs orangeries,Environnement
Des tables de tri des déchets dans les cantines scolaires,Education et jeunesse
Activités sportives urbaines dans le 14e / Foot à 5 et agrès à Jules Noël,Sport
De nouveaux équipements dans les squares et jardins du 12e / square Philippe Farine,Cadre de vie
La Petite Ceinture dans les quartiers populaires / PC20 Passerelle rue de la Mare,Cadre de vie
Rénovation du TEP Thiéré,Sport
Multi équipements Lancry,Environnement
Cultiver dans les écoles / Ecole 2/3,Education et jeunesse
Cultiver dans les écoles / Ecole 1/4,Education et jeunesse
Cultiver dans les écoles / Ecole 7/12,Education et jeunesse
Cultiver dans les écoles / Ecole 11/12,Education et jeunesse
Cultiver dans les écoles / Ecole 9/17,Education et jeunesse
Cultiver dans les écoles / Ecole 10/17,Education et jeunesse
Cultiver dans les écoles / Ecole 16/17,Education et jeunesse
Cultiver dans les écoles / Ecole 12/12,Education et jeunesse
Cultiver dans les écoles / Ecole 7/11,Education et jeunesse
Cultiver dans les écoles / Ecole 1/30,Education et jeunesse
Cultiver dans les écoles / Ecole 5/30,Education et jeunesse
Cultiver dans les écoles / Ecole 12/30,Education et jeunesse
Cultiver dans les écoles / Ecole 13/30,Education et jeunesse
Cultiver dans les écoles / Ecole 18/30,Education et jeunesse
Cultiver dans les écoles / Ecole 27/30,Education et jeunesse
Embellir les cours des écoles du 18e arrondissement / Ecole 8,Education et jeunesse
Embellir les cours des écoles du 18e arrondissement / Ecole 29,Education et jeunesse
Embellir les cours des écoles du 18e arrondissement / Ecole 46,Education et jeunesse
matériel de nettoiement silencieux et non polluant Souffleuses électriques 021 15,Propreté
matériel de nettoiement silencieux et non polluant Souffleuses électriques 021 46,Propreté
matériel de nettoiement silencieux et non polluant Souffleuses électriques 021 47,Propreté
matériel de nettoiement silencieux et non polluant Souffleuses électriques 021 79,Propreté
matériel de nettoiement silencieux et non polluant Souffleuses électriques 021 84,Propreté
Du matériel de nettoiement silencieux et non polluant débroussailleuses électriques 023 17,Propreté
Du matériel de nettoiement silencieux et non polluant Tricycles électriques 026 3,Propreté
FOYATIER (1) ELEM,Education et jeunesse
GUSTAVE ROUANET (1) MAT,Education et jeunesse
MAURICE GENEVOIX (3) POLY,Education et jeunesse
RUISSEAU (6) MAT,Education et jeunesse
Viaduc des Arts- équipement ludiques,Cadre de vie
Bibliothèque François Villon,Culture et patrimoine
De nouveaux espaces ludiques pour les parcs du 19e / Réaménager les aires de jeux Fressart et Crimée des Buttes Chaumont,Cadre de vie
Rénovation les toilettes de l'Ecole élémentaire Glaciere,Education et jeunesse
Une ville plus propre et plus équipée / Achat de petits matériels de propreté  (pour la DPE),Propreté
Frigos solidaires,Solidarités
Cour Oasis - Ecole Levassor,Education et jeunesse
Ecole élémentaire Torcy,Education et jeunesse
Ecole polyvalente Pierre Foncin,Education et jeunesse
#Musiquepourtous Paris Anim',Culture et patrimoine
Des espaces ludiques dans toutes les écoles du XXème,Education et jeunesse
Des espaces ludiques dans toutes les écoles du XXème,Education et jeunesse
Des espaces ludiques dans toutes les écoles du XXème,Education et jeunesse
Equiper les écoles du 14ème-EP de l'Ouest,Education et jeunesse
La Boîte à Jouer-option jeux d'exterieurs A,Education et jeunesse
Des tables de tri des déchets dans les cantines scolaires,Education et jeunesse
+ de nature en ville / 14 - Aménagement d'un pollinarium,Environnement
Des chaussées rénovées ! - Boulevard de l'Hôpital,Cadre de vie
Pour une meilleure cohabitation piétons/automobilistes. Entrée de l'Avenue d'Ivry en provenance du boulevard Masséna.,Prévention et sécurité
Composteur Jules Verne 11ème,Propreté
Cendriers sondage,Propreté
Cendriers sondage,Propreté
Cendriers sondage,Propreté
Cultiver dans la crèche l'Epée des Bois,Environnement
Cultiver dans la crèche Tour d'auvergne,Environnement
Cultiver dans la crèche Charenton,Environnement
Cultiver dans la crèche Dunois,Environnement
Cultiver au jardin Italie,Environnement
Cultiver dans la crèche Léon Bollée,Environnement
Cultiver à la halte-garderie Porte de Vanves / Maurice Nogues,Environnement
Cultiver dans la crèche Morillons,Environnement
Cultiver dans la crèche Convention,Environnement
Cultiver dans la crèche Kosma,Environnement
Saveurs en partage,Solidarités
,Cadre de vie
Emmaüs Défi,Solidarités
TEP LUQUET,Sport
Jeu d'échec géant,Solidarités
Cultiver en ville / Subvention Elogie Siemp pour l’adaptation du site Parisculteurs 3 Parking Pelleport – Rigoles 20e,Environnement
+ de nature en ville / 04-Mares et espaces de biodiversité/ Square Georges Cain,Environnement
+ de nature en ville / 03-Mare Parc André Citroën,Environnement
Composteur collectif,Propreté
Harmoniser les grilles du square du temple - Elie Wiesel / poursuite de la rénovation des grilles du square,Cadre de vie
"L’escalade à l’école, pour les élèves et leurs parents",Sport
"Insonorisation, embellissement réfectoires écoles EM Paul Dubois",Education et jeunesse
Rénovation local activités personnes âgées Grand Belleville,Solidarités
Piscine Jean Boiteux,Sport
Une voirie pour toutes les mobilités / Rivoli entre Saint Denis et Bourdonnais,Mobilités
Des kits d'économies d’énergie pour les foyers parisiens,Solidarités
Terrains de pétanque Bastille,Sport
"F- SUIV 002280 - Améliorons l’environnement des usages du bois de Vincennes / 08 - Rénover les cheminements en broyat, notamment  le long des rivières",Environnement
Boîte à livres Square Claude Bernard,Culture et patrimoine
Action 1 : installation de panneaux solaires - école Maryse Hilsz (20e),Environnement
Potelets colorés - la Chapelle,Cadre de vie
Habillage de potelets rue de saussure,Culture et patrimoine
Fresque rue Christine Pisan,Culture et patrimoine
Ecole Compans Brunet,Education et jeunesse
Petits déjeuners Porte de la Chapelle,Solidarités
Collège A. Franck,Education et jeunesse
Expérimentation qualité de l'air - Ecole Claude Vellefaux,Education et jeunesse
Tableaux interactifs pour l'école polyvalente,Education et jeunesse
Des toilettes neuves pour toutes les écoles EE Ourcq A,Education et jeunesse
Espaces Ludiques dans les écoles du 16e,Education et jeunesse
"Des ordis, pas des tablettes, pour les écoles du 12eme",Education et jeunesse
Equipement de jeux de cour dans les cours d'école,Education et jeunesse
Equipement de jeux de cour dans les cours d'école,Education et jeunesse
Equipement de jeux de cour dans les cours d'école,Education et jeunesse
"Des ordis, pas des tablettes, pour les écoles du 12eme",Education et jeunesse
SAFIA GOLDEN FRIED CHICKEN,Attractivité et emploi
Ressourcerie hors les murs de la ressourcerie des Batignolles,Environnement
Densification des points Amistocks du 17e par Emmaüs Défi,Environnement
M OPTIC,Attractivité et emploi
ALIMENTATION GENERALE,Attractivité et emploi
LE CURIAL,Attractivité et emploi
Espaces Ludiques dans les écoles du 16e,Education et jeunesse
De nouvelles rues intelligentes dans le 15e - marquage Flowell,Environnement
Couverture du TEP Dunois,Sport
EM BOY ZELENSKI,Education et jeunesse
"Des ordis, pas des tablettes, pour les écoles du 12eme",Education et jeunesse
Installation de tables de tri sélectif des déchets dans les réfectoires des cantines scolaires,Environnement
Basket 3*3 au TEP Serrurier,Sport
Des cours pour vivre ensemble - EM Carnot,Education et jeunesse
Un véhicule frigorifique pour l'epicerie sociale solidaya,Solidarités
Réfection - rue des Pyrénées,Cadre de vie
Revitalisation commerciale du boulevard de Strasbourg et son quartier,Attractivité et emploi
Création d'une bibliothèque d'objets en réseau dans le 11e par l'association Zézenne,Solidarités
Collège R. Queneau - Rénovation de la cour,Education et jeunesse
02 - Eclairage public à détecteur de mouvement,Environnement
02 - Cultures sur la terrasse du bâtiment du 100 Établissement Culturel Solidaire,Environnement
EM Archereau - Rénovation des sanitaires,Education et jeunesse
Kiosque à musique sur le mail Binet,Solidarités
EE Bruxelles,Education et jeunesse
EM de la Grange Batelière,Education et jeunesse
Des outils numériques dans les écoles primaires du 11 / EE Froment,Education et jeunesse
Des outils numériques dans les écoles primaires du 11 / EE G. Cavaignac,Education et jeunesse
La Médiathèque Musicale de Paris de demain,Culture et patrimoine
Des cours oasis- EE Bercy,Education et jeunesse
EM Legouvé,Education et jeunesse
TEP de la Goutte d'or des couleurs vives - Goutte d'Or,Cadre de vie
Bornes rétractables,Mobilités
EM Traversière,Education et jeunesse
Réinventons la cantine des Ecoles Eblé et Duquesne,Education et jeunesse
Un camion pour Les Marmoulins de Ménil’,Solidarités
Rénover le gymnase Jean Jaurès,Sport
Ilôt piéton Bd Haussmann,Prévention et sécurité
Implantation d’arceaux pour le stationnement des vélos-cargos et triporteurs.,Cadre de vie
Rendre la place passage Championnet plus accueillante / végétalisation en pot,Cadre de vie
02 - Fontaines Wallace et brumisateurs,Cadre de vie
Vestiaire solidaire,Solidarités
Des aménagements pour le jardin du Chalet,Environnement
Ecole Kellner - Rénovation du Préau,Education et jeunesse
Création d'une bibliothèque d'école à la Maternelle du Parc des Princes,Education et jeunesse
Couverture du city stade Didot,Sport
Bibliothèque Maurice Genevoix,Culture et patrimoine
Etude diagnostic acoustique du quartier Porte Saint-Denis/Paradis,Santé
Couverture du TEP Croix Nivert,Sport
Club house à Max Rousié,Sport
01-Repenser le square Louis Majorelle,Environnement
Des espaces de jeux inclusifs pour l'EM A.Del Sartre,Education et jeunesse
Des quartiers handi-accueillants / Sonorisation des traversées piétonnes,Solidarités
