Titre de l'opération,Thématique
Action 3 : installation de panneaux solaires bailleur social 20e (Elogie),Environnement
Complément Bricothèque-Ressourcerie du 15e,Solidarités
Investissement plateforme en ligne EthiKdo,Solidarités
Jardin de pluie expérimentale école du Breuil,Environnement
Repair café CLAJE,Solidarités
Des espaces ludiques dans toutes les écoles du XXème,Education et jeunesse
Des espaces ludiques dans toutes les écoles du XXème,Education et jeunesse
Equiper les écoles du 14ème-EE Rouvier,Education et jeunesse
Equiper les écoles du 14ème -EM de l'Ouest,Education et jeunesse
La Boîte à Jouer-option jeux d'exterieurs,Education et jeunesse
La Boîte à Jouer-option jeux d'exterieurs,Education et jeunesse
Des tables de tri des déchets dans les cantines scolaires,Education et jeunesse
Pour une meilleure cohabitation piétons/automobilistes. Croisement Avenue de Choisy / Rue Philibert Lucot,Prévention et sécurité
Projet OASIS école Jenner,Environnement
Projet OASIS école Louis Vierne,Environnement
Projet OASIS école Foyatier,Environnement
Projet OASIS Groupe scolaire Aubervilliers,Environnement
Cendriers sondage,Propreté
Cendriers sondage,Propreté
Cendriers sondage,Propreté
Fontaine rue Stendhal,Cadre de vie
fontaine Saint Blaise,Cadre de vie
Cultiver dans la crèche Littré,Environnement
Cultiver dans la crèche Littré,Environnement
Cultiver dans la crèche Hauteville,Environnement
Cultiver dans la crèche Sabin,Environnement
Cultiver dans la crèche Montgallet,Environnement
Fresques marché des Batignolles,Attractivité et emploi
Fondation Armée du Salut Palais de la Femme,Solidarités
SousLesPavésDesFleurs / Du gazon sur les trottoirs  / Débituminage avenue Maurice Ravel à Paris 12eme,Environnement
Composteur collecteur square Jean Allemane,Environnement
Paris plus propre : + de toilettes et + de technologie au service de la propreté / Toilettes innovantes / 02- Urinoir Mme Pee - square Tino Rossi,Propreté
#SousLesPavésDesFleurs / Mares et espaces de biodiversité dans les QP / centre sportif poissonniers,Environnement
Restauration fresque école Romainville,Education et jeunesse
Civiliser les trottoirs surplombant la petite ceinture,Cadre de vie
Aider les personnes fragiles à s'intégrer durablement,Solidarités
UN LABORATOIRE OUVERT ET CITOYEN ENVIRONNEMENT et SANTE,Environnement
Sauvons la fontaine Molière !,Culture et patrimoine
Rénovations des vestiaires et des douches,Sport
Collège Berlioz,Education et jeunesse
Faire du numérique une chance pour tous,Solidarités
Une voirie pour toutes les mobilités / Place Coluche,Mobilités
Une voirie pour toutes les mobilités /Alesia entre Plantes et Maindron (plantes exclu),Mobilités
Une voirie pour toutes les mobilités / Place Charles de Gaulle,Mobilités
Une voirie pour toutes les mobilités / Flandre entre Stalingrad et Soissons,Mobilités
Une voirie pour toutes les mobilités / Rue Maryse Hilsz entre lagny et Porte de Montreuil,Mobilités
Création d'une tribune pour le terrain de Football,Sport
Rue des Prairies,Environnement
#SousLesPavésDesFleurs / Du gazon sur les trottoirs  / Débituminage 49 rue Louis Blanc à Paris 10eme,Environnement
Hommage à Gérald Bloncourt,Cadre de vie
Facilitation numérique et domiciliation administrative,Solidarités
Extension du mur d'escalade du gymnase Paul Meurice,Sport
Aide à l'organisation d'événements écoresponsables - Pavillon Zéro déchet à la Caserne de Reuilly,Propreté
Réhabiliter le terrain de Basket Ball,Sport
Des tableaux numériques/POLY LAS CASES,Education et jeunesse
Essaimage des repair café à Paris (11/10),Solidarités
Des boîtes à jouer et des ludothèques dans les écoles des quartiers populaires,Education et jeunesse
Boîte n°1 - Des boîtes à livres pour le 10e arr.,Solidarités
"Des ordis, pas des tablettes, pour les écoles du 12eme, 70 daumesnil",Education et jeunesse
"Des ordis, pas des tablettes, pour les écoles du 12eme",Education et jeunesse
Un véhicule pour des ressourceries éphémères,Solidarités
E- SUIV 002168 -  Une voirie pour toutes les mobilités / 25 Convention,Mobilités
Sécurisation de l'espace public,Mobilités
Préau école élémentaire EE E.Varlin,Education et jeunesse
Espaces Ludiques dans les écoles du 16e,Education et jeunesse
Reliquat pour Tennis Rousié,Sport
Du gazon sur les trottoirs  / Debitumage  impasse Girardon/square Suzanne Buisson,Environnement
"Des ordis, pas des tablettes, pour les écoles du 12eme",Education et jeunesse
Installation de tables de tri sélectif des déchets dans les réfectoires des cantines scolaires,Environnement
EE Blanche,Education et jeunesse
01 - mur végétalisé sur la façade de l'école Écluses Saint-Martin,Environnement
"01 - Création d’espaces consacrés aux cultures sur les toitures des équipements dans les quartiers Picpus, Reuilly-Diderot et Faubourg St Antoine",Environnement
Fablab solidaire - creation – innovation – art numerique,Solidarités
Le parc Monceau - Un parcours de course d'orientation,Sport
Bien grandir dans le 11e /  Des jardins comestibles pour les enfants et familles du 11ème,Education et jeunesse
Théodore Deck,Prévention et sécurité
Embellissement et modernisation des équipements de l’école - EE (AB Reuilly,Education et jeunesse
03 - Récupérateur d'eaux pluviales au gymnase Gamzon,Environnement
EE Buffault,Education et jeunesse
EE Clichy,Education et jeunesse
Aux P'tits Soins : création maison de soins pédiatriques,Santé
Des outils numériques dans les écoles primaires du 11 / EE cité Voltaire,Education et jeunesse
Care-Truck : l'institut de soin ambulant et solidaire,Solidarités
"Insonorisation, embellissement réfectoires écoles EP Beauregard",Education et jeunesse
Financement de PC portables pour l'aide sociale à l'enfance lors du premier confinement,Solidarités
Fresque sur le mur de l'école rue Romy Schneider - la Chapelle,Cadre de vie
Aménagement de deux terrains de pétanque/quilles,Environnement
Aménagement vestiaire solidaire et insertion,Solidarités
Aménagement d’une partie de la friche de la parcelle rue Stéphane Grappelli,Environnement
Sécuriser les carrefours du 17e,Prévention et sécurité
"Une cabane à lire, des jeux et de l’art à l’EE Reuilly A",Education et jeunesse
LUTTONS CONTRE LA RUPTURE NUMERIQUE DES ELEVES aux collège Paul Verlaine,Education et jeunesse
Des sols dans l'école Lamoricière,Cadre de vie
cour EE Fagon,Education et jeunesse
Accessibilité dans le 14e-EE 46 Boulard,Education et jeunesse
Rénover l'EM  Louis Vierne,Education et jeunesse
Un observatoire du ciel,Education et jeunesse
Les bâtiments publics ornementés de fresques murales représentant des animaux liminaires,Propreté
Cité scolaire F.Villon,Solidarités
Construction de case-obus au Jardin Frédéric Dard,Environnement
Des équipements numériques pour Les Hauts de Belleville,Solidarités
"Des murs végétalisés pour le 17ème ! /  végétalisation au-dessus du Boulevard Périphérique, rue de Courcelles",Environnement
Des équipements techniques et pédagogiques pour la Stratajm,Education et jeunesse
05.1 - Rénovation climatique du petit pavillon d'Ivry Levassor,Environnement
Renforcement végétalisation avenue Jean Jaurès,Environnement
Création et couverture d'un patinodrome au CS La Muette,Sport
COLLEGE Victor Hugo,Education et jeunesse
Doter l'association de matériel de secours,Santé
Un 15e plus solidaire,Solidarités
01-Aménager un potager pédagogique dans le jardin d’Éole,Environnement
01-Remettre en service les cascades et l’abreuvoir du parc de Belleville,Cadre de vie
Installation de VPI - EP Vaucanson,Education et jeunesse
Parc instrumental pour l'école de la Goutte d'or,Education et jeunesse
03-Fabrication de broyat de cagette local,Environnement
04-Création de garages à trottinette et vélo devant les écoles du 11ème,Cadre de vie
05-Réaménagement du Jardin Berthe Morisot,Environnement
Ecologie et solidarité : des lieux anti-gaspi dans tout Paris,Propreté
Soutien à l’équipement des plateaux techniques de l’école du réemploi et de la réparation - Fédération Envie,Attractivité et emploi
Crèche municipale Justice,Education et jeunesse
"Aménagement de l'Atelier des Familles : inclusion, sport, petite enfance",Solidarités
Aventure Kacila : offrir un espace de partage aux habitants,Solidarités
Cour Oasis à l'EE Ourcq (B),Education et jeunesse
Boîte n°4 - Des boîtes à livres pour le 10e arr.,Solidarités
Développer les assos vélos 2024,Mobilités
Complément de financement projet immo Ressourcerie du 10e,Solidarités
Travaux et aménagement local n°2 Ressource de Belleville,Solidarités
La Petite Rockette - Rénovation des espaces,Solidarités
Adapter les 32 crèches du 18e aux fortes chaleurs,Education et jeunesse
La Maison230 : ateliers intergénérationnels autour de l'économie circulaire !,Environnement
01 -  Transformer le jardin Damia en lieu de balade et de détente,Cadre de vie
Un environnement rafraîchi pour nos crèches et nos écoles,Education et jeunesse
Un studio numérique multifonctionnel,Cadre de vie
Végétaliser la façade de l’association d'accueil et d'accompagnement des usagers de drogues,Environnement
"01 - Rénover, revégétaliser et agrandir l’allée des chiens du parc Georges Brassens",Cadre de vie
CPA Jacques Bravo,Education et jeunesse
CPA Solidarité Angèle Mercier,Education et jeunesse
Pique nique et pétanque quai du lot,Education et jeunesse
03 - Rénovation des toilettes du Square Brassai,Environnement
Embellissons la fontaine de la Baleine Bleue,Cadre de vie
"Ciel de toit, rue du rendez-vous",Solidarités
Solidarité roquette fait sa transition écologique,Solidarités
Financement d'équipements pour l'association Extramuros,Solidarités
Le minibus associatif : un accès à la culture et aux loisirs,Education et jeunesse
10- La RENO !,Environnement
Jardin partagé Cambrai (Serre),Environnement
Les meubles circulaires - travaux d'installation dans le 19e,Propreté
Envie Paris - Implantation d'un atelier urbain dans le 20e,Propreté
Bis Boutique solidaire - Travaux d'une nouvelle boutique dans le 14e,Propreté
Un éco-point mobile square Villa Sainte-Croix,Propreté
Réfectoire école polyvalente PRIMO LEVI,Education et jeunesse
Une ruche sur le Champ de Mars,Environnement
Gradins au 104,Culture et patrimoine
Sécurisation traversées piétonnes Simon Bolivar,Mobilités
Convivialité avenue de Flandre,Cadre de vie
Rue de la solidarité,Education et jeunesse
Séquence n°2 (Avron - Ph. Auguste),Sport
Rénovation des sanitaires dans des établissements scolaires du 16e arrondissement,Education et jeunesse
Tables de tri école élémentaire BAUCHES,Environnement
Aménager le terre-plein central du boulevard Raspail entre la rue de Vaugirard et le boulevard du Montparnasse,Cadre de vie
Extension du square Berlioz,Cadre de vie
Liaison cyclable entre le boulevard de la Bastille et la rue Jules César,Mobilités
Création d'un parcours végétalisé de la Caserne de Reuilly au jardin de Reuilly,Environnement
Végétaliser le toit du gymnase du collège Pierre de Ronsard,Education et jeunesse
Installer une boîte à livres dans le 11e ( association du Quartier Saint-Bernard),Culture et patrimoine
Embellissement et apaisement des Rues Saint-Marc/Panoramas,Cadre de vie
Rénover la cour de récréation de l'école Sommerard,Education et jeunesse
"Restauration ""le nègre joyeux""",Culture et patrimoine
Une terrasse à lire - bibliothèque Sabatier,Culture et patrimoine
DE LA HALLE PAJOL A LA FRESQUE ROSA PARKS,Cadre de vie
"Poursuivre la végétalisation dans le 14e / 04-pose de jardinières rue de la Sablière, angle rue Saché",Environnement
Gymnase Rosa Parks,Sport
Végétaliser les boulevards Vaugirard et Pasteur,Cadre de vie
Col. Evariste Galois -toit 2 - 11 rue du Dr Bourneville 13e,Environnement
DuTEP et EM Philippe-Auguste - Alexandre Dumas -toit 2 - 68 avenue Philippe Auguste - 39 rue Alexandre Dumas 11e,Environnement
Toit végétalisé - Jean Dame 2eme ardt,Environnement
Achats de 1 800 chaises métalliques pliantes et 800 chiliennes en bois et tissus,Cadre de vie
Poursuivre la végétalisation dans le 14e / 01 - mur végétalisé 132 rue d'alésia,Environnement
Carrefour Valmy-Stalingrad-Lafayette,Cadre de vie
TEP Serurier,Sport
Faire revivre le Bassin Louis Blanc,Cadre de vie
Sécurisation du secteur Moines / Guy Môquet / Davy,Mobilités
Sanitaires école polyvalente BALANCHINE,Education et jeunesse
Rénover et agrandir l'Espace Jeunes de la rue Erard,Education et jeunesse
Grenier école élémentaire TOURNELLES,Education et jeunesse
Un auditorium à la médiathèque Yourcenar,Culture et patrimoine
Pour un meilleur passage de l'industrie !,Cadre de vie
améliorer l'espace du square Jules Verne,Cadre de vie
signalétique artistique porte de vanves,Cadre de vie
Piétonnisation de la rue Saint-Marc,Cadre de vie
Ecole primaire - 38 bd Reims 17e,Environnement
Ideas Box,Solidarités
"Rénovation de l'accueil de jour dans l'ESI ""Chez M. Vincent""",Solidarités
Fresque vallée de Fecamp / Coulée verte,Culture et patrimoine
Banc art qu'en ciel,Culture et patrimoine
Paris plus propre : + de toilettes et + de technologie au service de la propreté,Propreté
En piste/Quai d'Issy,Mobilités
Une nouvelle coulée verte av Daumesnil / Côté impair,Environnement
Pour des trottoirs plus larges : rue de la Grange-aux-Belles,Mobilités
Toit vegetalisé 9eme Ecole Rodier,Environnement
"Toit vegetalise 5eme Crèche contrescarpe, rue Lacépède",Environnement
A. Karr,Cadre de vie
+ de nature en ville / 4-Mares et espaces de biodiversité/42 - Rivières des Minimes,Environnement
Cour de récréation école élémentaire Renard,Education et jeunesse
Rénover circulation école maternelle DAUMESNIL,Education et jeunesse
Casiers Collège COURTELINE,Education et jeunesse
VPI école maternelle FELIX FAURE,Education et jeunesse
Table de tri école élémentaire PARC DES PRINCES,Environnement
Restaurant solidaire La Coop Mijotée (Restaurant La cantine de BabelVille,Solidarités
Les Eco-Charlie,Solidarités
Sécuriser les chemins des écoles du 12e,Prévention et sécurité
Sécuriser les chemins des écoles du 12e,Prévention et sécurité
Amenagement Point Paris Emploi 20è ardt (MLP),Solidarités
CPA Goscinny,Cadre de vie
Gymnase Pointe d'Ivry,Cadre de vie
Paris Stadium Charlemange,Sport
Paris Stadium CS Bagnolet,Sport
Colonnes à verre enterrée - rue de la Saïda (15e),Propreté
Des fontaines à boire dans tout Paris Fontaine Arceau 0392,Cadre de vie
Des fontaines à boire dans tout Paris Fontaine pétillante,Cadre de vie
Préau école élémentaire VICQ D'AZIR,Education et jeunesse
MCV Département,Solidarités
Table de Cana - Laboratoire traiteur antigaspi,Solidarités
#SousLesPavésDesFleurs / végétaliser les clôtures parisiennes - 75014 - Ecole Maurice d'Ocagne,Environnement
Un préau pour la cour de récréation de l'école Saint-Ange,Education et jeunesse
Un équipement sportif adapté aux handicaps,Sport
Pour un quartier Porte de Vincennes ludique et solidaire,Solidarités
Rénovation du Gymnase Cange,Sport
Un gymnase au collège de la Grange aux Belles,Education et jeunesse
Pose d'une barrière en bois protégeant le jardin du Ranelagh,Prévention et sécurité
"Moins de bruit, plus de qualité de vie à Château Rouge",Cadre de vie
Augmenter les capacités d'accueil pour l'activité Football,Sport
La cuisine de Rosa et ses milles saveurs,Solidarités
Création d'un espace lecture dans l'hôtel social rue de Joinville,Culture et patrimoine
Réaménagement des TEP Stalingrad,Sport
Faciliter les traversées piétonnes du Canal Saint-Martin,Prévention et sécurité
Renouveau au Parc Monceau ! / Nouvelles toilettes au Parc Monceau,Cadre de vie
De nouvelles toilettes publiques à Aligre et à Bercy / Aligre,Propreté
Extension du site d'Emmaüs Défi à Riquet,Attractivité et emploi
Subvention végétalisation houblon,Environnement
Embellissement d’un poumon vert du Quartier St-Bernard / transfert des tables de ping pong et baby foot esplanade renée lebas,Environnement
Plus de propreté dans l'espace public / Compacteurs Champs de Mars (dispositif anti-rats),Propreté
Cultiver dans les écoles / Ecole 5/5,Education et jeunesse
Cultiver dans les écoles / Ecole 2/9,Education et jeunesse
Cultiver dans les écoles / Ecole 7/9,Education et jeunesse
Cultiver dans les écoles / Ecole 1/3,Education et jeunesse
Cultiver dans les écoles / Ecole 6/18,Education et jeunesse
Cultiver dans les écoles / Ecole 4/17,Education et jeunesse
Cultiver dans les écoles / Ecole 4/12,Education et jeunesse
Cultiver dans les écoles / Ecole 18/23,Education et jeunesse
Cultiver dans les écoles / Ecole 10/11,Education et jeunesse
Cultiver dans les écoles / Ecole 9/20,Education et jeunesse
Cultiver dans les écoles / Ecole 9/30,Education et jeunesse
Cultiver dans les écoles / Ecole 22/30,Education et jeunesse
Cultiver dans les écoles / Ecole 25/30,Education et jeunesse
Cultiver dans les écoles / Ecole 13/21,Education et jeunesse
Cultiver dans les écoles / Ecole 3/18,Education et jeunesse
Reconquête urbaine / Fontaine au Roi,Cadre de vie
Embellir les cours des écoles du 18e arrondissement / Ecole 2,Education et jeunesse
Embellir les cours des écoles du 18e arrondissement / Ecole 31,Education et jeunesse
Embellir les cours des écoles du 18e arrondissement / Ecole 40,Education et jeunesse
Du matériel de nettoiement silencieux et non polluant Balayeuses Ramasseuses électriques 4,Propreté
matériel de nettoiement silencieux et non polluant Souffleuses électriques 021 27,Propreté
matériel de nettoiement silencieux et non polluant Souffleuses électriques 021 64,Propreté
matériel de nettoiement silencieux et non polluant Souffleuses électriques 021 94,Propreté
Du matériel de nettoiement silencieux et non polluant débroussailleuses électriques 023 16,Propreté
HOUDON (15) ELEM,Education et jeunesse
MARCADET (29) MAT,Education et jeunesse
Conservatoire municipal du 18e arrondissement,Culture et patrimoine
RENOVATION PH - SECTEUR PLACE HENRI MATISSE  (20e),Attractivité et emploi
OPPELIA,Solidarités
ecole maternelle passage beslay,Education et jeunesse
Isolation élémentaire 5 rue Jean Bouton,Education et jeunesse
Isolation maternelle 7 rue jean bouton,Education et jeunesse
Toilettes groupe scolaire 3 rue de belzunce,Education et jeunesse
Serre agricole My Food sur le toit-terrasse de l’ENSAAMA,Attractivité et emploi
Ecole Maurice d'Ocagne,Education et jeunesse
Hall Couture,Solidarités
Aménagement Résidence de l'Eau MA10,Solidarités
Action 3 : installation de panneaux solaires bailleur social 13e,Environnement
Evaluation du dispositif,Environnement
Association La Corde Raide,Solidarités
Equiper les écoles du 14ème -EE 7 rue Asseline,Education et jeunesse
Equiper les écoles du 14ème-EM,Education et jeunesse
La Boîte à Jouer-option jeux d'exterieurs,Education et jeunesse
La Boîte à Jouer-option jeux d'exterieurs,Education et jeunesse
La Boîte à Jouer-option jeux d'exterieurs,Education et jeunesse
La Boîte à Jouer-option jeux d'exterieurs,Education et jeunesse
La Boîte à Jouer-option jeux d'exterieurs,Education et jeunesse
Des tables de tri des déchets dans les cantines scolaires,Education et jeunesse
Des chausséees rénovées ! - Rue de l'Amiral Mouchez,Cadre de vie
Des chaussées rénovées ! - Boulevard Hippolyte Marquès,Cadre de vie
Projet OASIS école Boy Zelenski,Environnement
Projet OASIS Pilâtre de Rozier,Environnement
Projet OASIS Collgèe Germaine Tillon,Environnement
Projet OASIS école Vigée Lebrun,Environnement
MELTING POT,Attractivité et emploi
EL AMEN,Attractivité et emploi
Composteur Louis Blanc 10ème,Propreté
Cendriers sondage,Propreté
Pour des trottoirs plus larges et plus confortables,Mobilités
Projets 12 e,Solidarités
Cultiver dans la crèche Censier,Environnement
Cultiver dans la crèche Fleurus,Environnement
Cultiver dans le jardin d'enfant Général Humbert,Environnement
Cultiver dans la crèche Ouest,Environnement
Cultiver dans la crèche Préault,Environnement
Cultiver dans la crèche des Petites Ecuries,Environnement
Végétaliser le boulevard Voltaire - tronçon R. Lenoir République,Cadre de vie
Les Grains de Sel,Solidarités
SousLesPavésDesFleurs / Mares et espaces de biodiversité dans les QP / Jardin Villemin,Environnement
#SousLesPavésDesFleurs / Mares et espaces de biodiversité dans les QP / Square Colbert,Environnement
Une « matériauthèque » pour la construction écologique,Solidarités
Sauvegarde du grand orgue de Saint Eustache,Culture et patrimoine
Restauration de la statue de St Jean Baptiste,Culture et patrimoine
Rénovation du bassin et de la fontaine,Culture et patrimoine
Ouverture d'un café des enfants à la Goutte d'Or,Education et jeunesse
Végétaliser les pieds d'arbres,Environnement
"Rénovation, aménagement du centre social Solidarité Roquette",Solidarités
De nouvelles maisons de santé,Santé
Place aux piétons avenue du Maine !,Cadre de vie
Cultiver en ville / Jardin partagé -12eme - Toit tout vert / Achat composteurs verticaux,Environnement
Pots végétalisés aux croisements des rues Jeanne d'Arc et Clisson,Environnement
Matériel de nettoyage pour les locaux sportifs et les piscines,Sport
Rénovation des aires de jeux jardin Luc Hoffmann,Cadre de vie
Grand gymnase Caillaux,Sport
Végétaliser les murs et les toits dans le 15ème / 11-square Desaix,Cadre de vie
Agrès sportifs,Sport
Rénovation et fresque pour l'escalier du Centre Paris Anim' Mathis,Education et jeunesse
10Installer dans certains jardins du mobilier de jeux de société,Cadre de vie
Mettre en valeur la place Henri Frenay,Culture et patrimoine
Rénover le skate park des Fougères,Sport
Tables de tri dans les écoles,Propreté
Essaimage des repair café à Paris (7/10),Solidarités
Subvention régie de quartier du 12e,Solidarités
Jeux d'intérieurs adaptés aux enfants en situation de handicap,Solidarités
Des tableaux numériques/EE MOTTE PICQUET,Education et jeunesse
Le plaisir de lire dans l'EE 188 Alésia,Education et jeunesse
"Des ordis, pas des tablettes, pour les écoles du 12eme",Education et jeunesse
"Des ordis, pas des tablettes, pour les écoles du 12eme, _8 baudelaire",Education et jeunesse
Equipement de jeux de cour dans les cours d'école,Education et jeunesse
Embellissement de la Porte de Saint-Ouen,Cadre de vie
CENTRE CANIN,Attractivité et emploi
QUATRE HEURES,Attractivité et emploi
VOILES POUR PROTECTION SOLEIL ET PLUIE DANS LA COUR ECOLES,Education et jeunesse
"Insononorisation, embellissement réfectoires écoles EE 4 fils",Education et jeunesse
D- SUIV 002785 - #SousLesPavésDesFleurs / Du gazon sur les trottoirs  / Debitumage  4 rue Saint Nicolas,Environnement
"Des ordis, pas des tablettes, pour les écoles du 12eme",Education et jeunesse
Basket 3*3 TEP Calmette,Sport
aménagement coin lecture,Education et jeunesse
01 - Dynamiser le jardin partagé Fleur de Bitume (square Dalpayrat),Cadre de vie
TEP Archereau,Sport
EE rue de Florence - La rénovation du préau,Sport
Panneau - carrefour rue émile landrin,Cadre de vie
Réfections et pieds d'arbres,Cadre de vie
02 - Un jardin partagé accessible à tous les handicaps: Ombrelle et Coccinelle (square Marie-Poussepin),Cadre de vie
EM Jouffroy d'Abbans - Amélioration du cadre de vie,Education et jeunesse
La rue de la conversation,Solidarités
2Des vélos pour les jeunes de Blémont,Sport
EM Chaptal,Education et jeunesse
EM Buffault,Education et jeunesse
Des outils numériques dans les écoles primaires du 11 / EE 11B Parmentier,Education et jeunesse
Des outils numériques dans les écoles primaires du 11 / EE Saint Maur,Education et jeunesse
Escalade au gymnase Tandou,Sport
Végétalisons Paris Centre : Bibliothèque Arthur Rimbaud lieu de fraîcheur,Culture et patrimoine
Aménagement et équipement Pension de famille Julien Lacroix,Solidarités
Une ombrière pour le jardin de la résidence Madeleine Béjart,Solidarités
Rénovation du TEP Henri Sauvage,Sport
Camionnette douche mobile,Solidarités
Eglise St Germain l'Auxerrois,Solidarités
Ralentisseurs Rue Pierre Charon,Prévention et sécurité
Implanter des collecteurs de mégots dans le 10e,Environnement
TEP Pailleron,Sport
2/04/120Espace extérieur Chaumont Lepage,Sport
Sécurisation rue de Ponthieu,Cadre de vie
Restauration de la fontaine place Jacques Rueff,Culture et patrimoine
"Renouvellement du parc technique de ""3615 Radio""",Solidarités
"Rénovation de la cour de l’école Clignancourt en type ""Oasis""",Environnement
Plus de fontaines à boire dans le 19e,Environnement
Végétaliser les abords de l'école Froment,Environnement
Tablettes numériques,Solidarités
Des équipements pour les distributions d'Afood-Arc-en-ciel,Solidarités
Achat de matériel informatique pour activités d’accompagnement,Solidarités
Installer une ombrière à l'entrée du parc floral,Environnement
HAWA au féminin,Solidarités
Jardin’âges : l’écologie en actions intergénérationnelles,Solidarités
Restauration des peintures,Culture et patrimoine
Un espace de proximité dédié à la création artistique dans un parking de la Goutte d'Or,Culture et patrimoine
Du matériel à partager pour les associations du 14ème,Solidarités
Equiper les habitants du 18e pour les activités solidaires,Solidarités
01-Redonner un nouvel éclat à la roseraie du square René le Gall,Environnement
inancer des instruments de musique pour les élèves de Paris Centre,Education et jeunesse
"6Cours Oasis - EM 15, rue Chantin",Education et jeunesse
02-Faire rimer accès au numérique avec enjeux écologiques au sein de la Régie de quartier Fécamp,Environnement
07-Végétalisation de la place Alphonse Karr,Cadre de vie
Faciliter le don des parisien.n.es et insérer au mieux les plus éloigné.e.s de l'emploi,Solidarités
