Titre de l'opération,Thématique
Transformation de la halte du centre social Aires 10,Solidarités
Scène roulante pour Saint-Blaise et les Portes du 20ème,Culture et patrimoine
Renforcer la place de la biodiversité dans le 11ème / 01 - panneaux pédagogique square Maurice Gardette,Environnement
Une voirie pour toutes les mobilités / Bld de Charonne entre Trône et Avron,Mobilités
Itinéraire historique identifiant les lieux les plus significatifs du quartier,Culture et patrimoine
Ateliers sportifs sous le métro aérien boulevard Vincent Auriol,Sport
Toilettes innovantes / Toilettes sèches jardin partagé de la Villa des Tulipes,Propreté
#SousLesPavésDesFleurs / Du gazon sur les trottoirs / Débitumage quai de Jemmapes à Paris 10eme,Environnement
2785 - #SousLesPavésDesFleurs / installation de bacs végétalisés aux abords de la crèche situé Place Henri Frenay,Environnement
Toilettes Ecole LM Nordmann,Education et jeunesse
Des sanitaires neufs pour l'EE Fessart,Education et jeunesse
Poursuite de l'extension du bric à brac d'Emmaüs Défi (Chantier d'insertion),Solidarités
"Insononorisation, embellissement réfectoires écoles EM Perle",Education et jeunesse
Des boîtes à jouer et des ludothèques dans les écoles des quartiers populaires,Education et jeunesse
"Des ordis, pas des tablettes, pour les écoles du 12eme",Education et jeunesse
CAMA ELECTROMENAGER,Attractivité et emploi
D- SUIV 002785 - #SousLesPavésDesFleurs / Du gazon sur les trottoirs  / Debitumage 11 passage Briare,Environnement
Jardin Pixérécourt Extension sur voirie,Environnement
Achat de véhicules électriques et silencieux,Propreté
Actualisation du parc informatique - EM Bd Richard Lenoir,Education et jeunesse
Aménagement de la Maison du Projet,Solidarités
Coopérative de restaurateurs - les nouvelles marmites,Solidarités
TEP Barbanègre,Sport
EP H. Noguère - Rénovation des sanitaires,Education et jeunesse
Aménagements ludiques - Place de Joinville et rue Jomard,Education et jeunesse
EE Milton,Education et jeunesse
EE Tour d'Auvergne,Education et jeunesse
Des outils numériques dans les écoles primaires du 11 / EE République,Education et jeunesse
Réalisation d'une rampe d'accès PMR à St-Pierre-du-Gros-Caillou,Culture et patrimoine
Rénovation du grand orgue de l'Eglise Saint-François-Xavier,Culture et patrimoine
Restauration de la chapelle Saint Joseph de la Basilique Sainte-Clotilde,Culture et patrimoine
Benoîte Groult à l'honneur dans sa bibliothèque,Culture et patrimoine
Solde,Solidarités
"Insonorisation, embellissement réfectoires écoles EE Louvois",Education et jeunesse
Financement de contenants réutilisables pour la Consigne GreenGo,Solidarités
Bien grandir dans le 11e /  Des jardins comestibles pour les enfants et familles du 11ème/Cours Oasis EE St Sébastien,Education et jeunesse
EM rue d'Alleray,Education et jeunesse
Rénover le centre social des Epinettes,Solidarités
Aire de jeux inclusive square Garibaldi,Environnement
Etude préalable au lancement de la réfection des grilles de la place de l'Europe,Cadre de vie
Rénovation du local du Camres,Solidarités
Aménagements rue Washington,Cadre de vie
Création d'un parc canin Boulevard Richard Lenoir,Cadre de vie
Auditorium 2.0 / Conservatoire Paul Dukas,Culture et patrimoine
Parcours street art ludique au quartier Lamoricière,Cadre de vie
Acquisition de matériel et de livres pour la bibliothèque de rue,Solidarités
Une bagagerie dans le 18e !,Solidarités
EM A.Netter,Education et jeunesse
cours Jenner,Education et jeunesse
"Ressourcie 10e, Le Chamodix, soutien invest initiaux",Solidarités
Construction d'un ascenseur d'accès à la Bibliothèque Lecourbe,Culture et patrimoine
"Accessibilité, rénovation et sécurisation Eglise Saint François-Xavier",Culture et patrimoine
Installation d'arceaux vélos place du Panthéon,Mobilités
01-Rénovation du parcours santé de la coulée verte du 12ème,Environnement
Des Rénovations dans les Gymnases,Sport
03-Réfection des pieds d'arbres avenue de la porte de Villiers,Culture et patrimoine
Rénovation de la toiture,Sport
Lieu culturel ouvert à tout·es : il faut sauver le Café Reflets !,Solidarités
Ouvrir l'EP Pajol au quartier,Education et jeunesse
Végétalisation de plusieurs murs de Paris Centre,Cadre de vie
02-Réaménagement du jardin situé à l’angle des rues Littré et Vaugirard,Environnement
Faire de Kiwanda un lieu de vie et d'accueil inconditionnel,Solidarités
04-Jardin’âges : l’écologie en actions intergénérationnelles,Environnement
06-Embellir le square Breguet Sabin,Environnement
05-Pour des espaces verts rénovés - Aire de jeux Belleville/Télégraphe,Cadre de vie
Rénovation du Gymnase Marcel Cerdan,Solidarités
EE rue JOMARD,Education et jeunesse
Rénovation de la piste et du plateau d'athlétisme,Sport
Créer d’avantages d’espaces canins à Paris,Cadre de vie
"Tennis pour tous en toute saison , en tout confort et toujours gratuit",Sport
Brumisateurs urbains adaptée aux fontaines Wallace,Environnement
Pour des écoles plus accueillantes / Ecole Lacordaire,Education et jeunesse
Créer un espace de respiration convivial entre les grands axes du Nord de Paris,Cadre de vie
Rénover les écoles du 20e /Maternelle 99 Pelleport protection climatique,Education et jeunesse
Rénover les écoles du 20e / EM Eugène Reisz - Sanitaires,Education et jeunesse
Rénover les écoles du 20e / EP Piat - Sanitaires,Education et jeunesse
03-Création d'un terrain de pétanque au parc Georges Brassens,Cadre de vie
04-Rénover et compléter les équipements sportifs de plein air,Cadre de vie
02-Du mobilier modulable pour la Petite Ceinture du 15e,Environnement
Restauration du plafond peint de la chapelle des Fonts à Saint-Médard,Culture et patrimoine
Rénovation du local avec Slashfit,Cadre de vie
Restauration de la chapelle de la Vierge,Culture et patrimoine
Un nouvel éclairage à Biancotto,Sport
Équipements pour l'accueil des habitants du quartier BellevilleFontaine au Roi/Le Picoulet,Cadre de vie
01 – installation de bancs place de la Garenne,Environnement
03 - Installer une pompe  à vélo en libre service,Mobilités
reliquats,Solidarités
Vesto - poursuite travaux Galerie circulaire + investissements en communication,Propreté
Art urbain à Bonne nouvelle,Cadre de vie
Fresque Pont Pascal,Culture et patrimoine
Améliorer la visibilité du carrefour Père Guerin/ Moulin des Prés,Prévention et sécurité
Végétalisation des rues de l'arrondissement / rues Lyonnais et Gay Lussac,Cadre de vie
Mur Végétal (65 Rue du Bac 75007),Cadre de vie
1/126Végétalisation du mur aveugle du 318 rue Saint-Jacques,Cadre de vie
Rénovation Gymnase bas,Sport
"Création d'un véritable ""Coeur de Ville"" dans le 20ème",Cadre de vie
Insonorisation du puit de lumière Collège Germaine Tillion,Education et jeunesse
"Du vert pour le 13e /2-Végétaliser la placette du bas de la rue Duméril pour la rendre plus chaleureuse en végétalisant le mur de l'escalier du bas de la rue, et en mettant 6 grands pots de fleurs aussi bien sur la placette qu'en haut de l'escalier.",Environnement
Sécuriser l'espace public dans le 17ème arrondissement,Prévention et sécurité
Réaménagement de la rue de la Condamine,Cadre de vie
"Square Maurice Gardette, Kiosque à musique",Cadre de vie
"Square Jean Morin, Kiosque à musique et locaux jardiniers",Cadre de vie
"Jardin du Ranelagh, Kiosque à musique",Cadre de vie
Végétalisation des murs et des rues du 14e arrondissement / végétalisation d'un mur à l'école Maurice d'Ocagne,Environnement
Végétaliser les trottoirs du 15ème / 05-plantations au carrefour Liouville/Dorchain,Cadre de vie
Achat de matériel de jardinage qui seront mis à disposition dans les MA,Environnement
Création de « parklet » Association DEDALE,Cadre de vie
Mur peint 12ème,Culture et patrimoine
"L’enseigne de la rue moufle, de Robert Doisneau au sein du jardin Truillot",Culture et patrimoine
Etude rénovation et accessibilité vestiaires du gymnase,Sport
Square Eugénie-Cotton,Sport
Réaménager la place Marek Edelman,Cadre de vie
halle alimentaire 15e,Solidarités
Humanisation de la placette 39-41 avenue de Clichy,Cadre de vie
De nouveaux espaces ludiques pour les parcs du 19e / ajout de mobiliers sur la pelouse Jardin Anaïs-Nin,Cadre de vie
Remplacement des agrès TEP Varet,Sport
Module de jeux pour enfants dans le square Gabriel Pierné,Education et jeunesse
Amélioration du matériel des CS du 5è_Gym. Lavoisier,Sport
#SousLesPavésDesFleurs / Des murs végétalisés le long du périphérique  / 01- Maryse Hilsz,Environnement
Création de stationnement deux-roues (vélos et motorisés),Cadre de vie
Apaiser les rues historiques de Belleville,Cadre de vie
Réinventons la Coulée Verte René – Dumont,Cadre de vie
Créer un quartier piéton autour du square Maurice Gardette,Cadre de vie
Faire du beau au niveau du 67-85 Fontaine au roi /  / installation de bacs de végétalisation,Cadre de vie
Création d'un outil numérique de gestion des domiciliations,Solidarités
Projet territoire zéro chômeur de longue durée - 13 Avenir - Expérimentation sur 5 ans,Solidarités
Réaménager la place St Blaise,Cadre de vie
Réaménager le carrefour Crespin du Gast / Passage de Menilmontant,Cadre de vie
Séquence n°1 (Pl. Nation à Avron),Sport
Fitness parc Suzanne Lenglen,Sport
àPorte de Montreuil,Mobilités
En piste /porte de Saint-Ouen,Mobilités
"En piste, porte de Montrouge",Mobilités
Lauréat Coup de Pouce Commerce: BIENVENUE,Attractivité et emploi
Rue de Crimée,Mobilités
VPI école polyvalente FRANC NOHAIN,Education et jeunesse
Réfectoire école maternelle DR ARNOLD NETTER,Education et jeunesse
VPI école maternelle GUTENBERG,Education et jeunesse
Innovation école polyvalente FRERES VOISIN,Education et jeunesse
VPI école maternelle PROCESSION,Education et jeunesse
Jardin pédégogique Cour école maternelle et élémentaire MOURAUD,Education et jeunesse
"Pour un arrondissement « treize » accessible aux personnes handicapées,  à mobilité réduite",Mobilités
SWO Sq. Varlin,Sport
SWO Carpentier,Sport
SWO et fitness Sq. Brunot,Sport
Fitness Sq. Samuel de Champlain,Sport
Du matériel de nettoiement silencieux et non polluant Aspirateur Glutton 020 1,Propreté
Des fontaines à boire dans tout Paris Fontaine Fontaine Arceau,Cadre de vie
Des fontaines à boire dans tout Paris Fontaine Pétillante,Cadre de vie
Du vert pour le 13e /4-Installer des bacs en bois sur l’Avenue de France,Environnement
Quartier Libre XI,Solidarités
Coop mijotée,Solidarités
Fédération des Associations pour l'intégration des migrants asiatiques,Solidarités
"Composteur Association ""Cité Industrielle Environnement"" (11e)",Propreté
Composteur Les amis du jardin de la sainte Félicité,Propreté
"Ecole Alquier debrousse, 12 allée Alquier Debrousse",Environnement
Acquisition de matériel électrique pour les services de la Propreté,Propreté
Coud' à coud',Solidarités
+ de nature en ville / Ruchers; appel à projets / Square Sainte-Odile,Environnement
Un local neuf pour l'AS Centre et les jeunes,Sport
Une boîte à livres sur la placette Davy/Guy Môquet,Culture et patrimoine
Réfection des trottoirs du 6e arrondissement suite,Prévention et sécurité
Embellir et sécuriser le boulevard de Magenta,Cadre de vie
Favoriser l'accueil de manifestations aux Arènes de Lutèce,Culture et patrimoine
"Le camion Refettorio : intégration, conseils légaux, repas",Solidarités
Lutte contre le gaspillage alimentaire,Solidarités
Des urinoirs dans les rues du 10e,Propreté
Modernisation de la piscine Aspirant Dunand,Sport
Jardin Eole,Environnement
Restaurer le massif d'entrée de l’église Notre-Dame-de-la-Gare,Culture et patrimoine
Tennis de table dans les parcs et jardins,Sport
Des cheminements piétons sécurisés et accessibles  / Rénovation des allées du square de l'avenue Laperrine,Cadre de vie
Cultiver dans les écoles / Ecole 3/3,Education et jeunesse
Cultiver dans les écoles / Ecole 2/5,Education et jeunesse
Cultiver dans les écoles / Ecole 1/6,Education et jeunesse
Cultiver dans les écoles / Ecole 5/12,Education et jeunesse
Cultiver dans les écoles / Ecole 18/18,Education et jeunesse
Cultiver dans les écoles / Ecole 8/12,Education et jeunesse
Cultiver dans les écoles / Ecole 10/12,Education et jeunesse
Cultiver dans les écoles / Ecole 6/20,Education et jeunesse
Cultiver dans les écoles / Ecole 11/30,Education et jeunesse
Cultiver dans les écoles / Ecole 15/30,Education et jeunesse
Cultiver dans les écoles / Ecole 8/21,Education et jeunesse
Embellir les cours des écoles du 18e arrondissement / Ecole 9,Education et jeunesse
Embellir les cours des écoles du 18e arrondissement / Ecole 28,Education et jeunesse
matériel de nettoiement silencieux et non polluant Souffleuses électriques 021 11,Propreté
matériel de nettoiement silencieux et non polluant Souffleuses électriques 021 37,Propreté
matériel de nettoiement silencieux et non polluant Souffleuses électriques 021 52,Propreté
matériel de nettoiement silencieux et non polluant Souffleuses électriques 021 59,Propreté
matériel de nettoiement silencieux et non polluant Souffleuses électriques 021 62,Propreté
matériel de nettoiement silencieux et non polluant Souffleuses électriques 021 67,Propreté
matériel de nettoiement silencieux et non polluant Souffleuses électriques 021 97,Propreté
matériel de nettoiement silencieux et non polluant Souffleuses électriques 021 107,Propreté
matériel de nettoiement silencieux et non polluant Batterie Souffleuses électriques 5,Propreté
matériel de nettoiement silencieux et non polluant Batterie Souffleuses électriques 10,Propreté
Stiores extérieurs élémentaire 83 avenue michel bizot,Education et jeunesse
Cantine Ecole élementaire Maroc,Education et jeunesse
Rénovation de la Danse de la fontaine émergente,Culture et patrimoine
Composteur Square Eloise et Abélard,Propreté
Equiper l'association Onze mille potes,Solidarités
Des espaces ludiques dans toutes les écoles du XXème,Education et jeunesse
Des espaces ludiques dans toutes les écoles du XXème,Education et jeunesse
Des espaces ludiques dans toutes les écoles du XXème,Education et jeunesse
Equiper les écoles du 14èm- EE square A.Fournier,Education et jeunesse
Equiper les écoles du 14ème -EE Prisse-d'Avennes,Education et jeunesse
Equiper les écoles du 14ème-EE Sévero,Education et jeunesse
La Boîte à Jouer-option jeux d'exterieurs,Education et jeunesse
La Boîte à Jouer-option jeux d'exterieurs,Education et jeunesse
La boite à jouer,Education et jeunesse
Des chaussées rénovées ! - Rue de Clisson,Cadre de vie
Des chaussées rénovées ! - Rue Pierre-Joseph Desault,Cadre de vie
Projet OASIS école Emile Levassoir,Environnement
BOULANGERIE AA,Attractivité et emploi
LA ROYALE,Attractivité et emploi
Composteur Le Bois Dormoy 18ème,Propreté
18 rues sans mégots cendriers sondage,Propreté
Cultiver dans la crèche Saint Medard,Environnement
Cultiver dans la crèche Javelot,Environnement
Cultiver dans la crèche Jean Fautrier,Environnement
Cultiver dans la crèche Broussais,Environnement
Cultiver dans la crèche Lacordaire,Environnement
Cultiver dans la crèche Massé Pigalle,Environnement
Cultiver dans la crèche Léon Schwartzenberg,Environnement
Paris aux piétons / Création de Parklets / Rue des Quatre Frères Peignot (Asso Dédale),Cadre de vie
Paris aux piétons / Création de Parklets / Rue André Messager,Cadre de vie
NEAG 3,Solidarités
Bureaux 103 - toiture 1,Environnement
Cultiver en ville / Subvention Paris Habitat - résidence 28 rue Brillat Savarin,Environnement
#SousLesPavésDesFleurs / Mares et espaces de biodiversité dans les QP / Jardin Vercingétorix - Brune,Environnement
Echange culturel par la couleur dans la rue de l’échiquier,Cadre de vie
"La Cuisine sur Place, atelier culinaire en extérieur pour tous",Solidarités
POUR UN CONSERVATOIRE PLUS ADAPTE ET EQUIPE,Culture et patrimoine
Des nouveaux jeux et des équipements vélo au square Jacques-Bidaut,Education et jeunesse
Plus d'équipements dans nos écoles EM Théodore Deck,Education et jeunesse
Expérimentation d'aires de dépose et d'échange,Mobilités
Des panneaux photovoltaïques sur les bâtiments municipaux,Environnement
Un terrain couvert pour bel air nord,Education et jeunesse
L'école maternelle André Bréchet rénovée !,Education et jeunesse
Balisage du chemin de Saint-Jacques de Compostelle,Culture et patrimoine
Pour que la musique baroque rayonne au conservatoire,Culture et patrimoine
Restauration et mise aux normes de sécurité des horloges de l’église St-François-Xavier,Culture et patrimoine
Création de places de stationnement 2 roues,Mobilités
Des stationnements pour vélos aux entrées du Parc MLK / création d'une aire de stationnement vélos à l'intérieur du Parc,Prévention et sécurité
Murs végétalisés le long des clôtures du boulevard MacDonald,Environnement
Rénovation du city stade Claude Bernard,Cadre de vie
"Moi et mes enfants, boulevard Auriol (PH)",Solidarités
Une voirie pour toutes les mobilités / Avenue du général Laperrine,Mobilités
"Une voirie pour toutes les mobilités /Pourtour de la porte de la Villette : chemin de fer, commanderie",Mobilités
Renforcer la place de la biodiversité dans le 11ème / 03 - un keyhole au jardin Marcotte,Environnement
Fontaine Arceau place Mohamed V,Cadre de vie
"Cultiver en ville / Jardins partagés - Subvention à l’association Le Jardin d’Eugénie, pour jardin partagé Le P’tit Jardin",Environnement
Action 1 : installation de panneaux solaires - école Parmentier (10e),Environnement
Végétalisation,Culture et patrimoine
Fresque au square Paray,Culture et patrimoine
Essaimage des repair café à Paris (8/10),Solidarités
Poursuite de l'extension du bric à brac d'Emmaüs Défi,Attractivité et emploi
Des tableaux numériques/ EE EBLE,Education et jeunesse
Des cantines plus agréables EE 32 place Jeanne d'Arc,Education et jeunesse
Le plaisir de lire dans l' EE Ocagne,Education et jeunesse
Collège Marx Dormoy,Education et jeunesse
Ecole Dumas,Education et jeunesse
Espaces Ludiques dans les écoles du 16e,Education et jeunesse
Espaces Ludiques dans les écoles du 16e,Education et jeunesse
"Des ordis, pas des tablettes, pour les écoles du 12eme",Education et jeunesse
Equipement de jeux de cour dans les cours d'école,Education et jeunesse
Equipement de jeux de cour dans les cours d'école,Education et jeunesse
LE FLANKER,Attractivité et emploi
Des ordinateurs chauffages - la Petite Fabrique,Solidarités
De nouvelles rues intelligentes - éclairage public et stationnement,Environnement
D- SUIV 002785 - #SousLesPavésDesFleurs / Du gazon sur les trottoirs  / Débitumage Bd Ney impasse Alexandre Lecuyer,Environnement
"Aérons mieux les collèges, les écoles et les crèches",Environnement
Rénovation et accessibilité du Gymnase des Lilas,Sport
Réinsérer via la collecte à vélo des cartons usagés,Solidarités
03 - mur végétalisé sur le mur du collège Louise Michel,Environnement
Réfections chaussée St Ouen,Mobilités
Espaces d'agriculture urbaine,Environnement
Aménagement des espaces extérieurs - EE (A) Reuilly,Education et jeunesse
04 - Avenue Albert Bartholomé Réfection pieds arbres,Cadre de vie
EM de Rochechouart,Education et jeunesse
Des outils numériques dans les écoles primaires du 11 / EE Pihet,Education et jeunesse
Des outils numériques dans les écoles primaires du 11 / EE Servan,Education et jeunesse
Homologation du terrain de rugby de Ladoumègue,Sport
Végétalisons Paris Centre : Bibliothèque La Canopée lieu de fraîcheur,Culture et patrimoine
Ordinateurs et matériel de gym pour sans-abri,Solidarités
Fit'Truck : une salle de sport mobile,Sport
Bien grandir dans le 11e /  Des jardins comestibles pour les enfants et familles du 11ème/Cours Oasis EM Voltaire,Education et jeunesse
Travaux jardin partagé square Raymond Souplex (18e).,Environnement
Parcours de santé en plein air,Sport
Pérennisation feu carrefour quai de conti / pont neuf,Mobilités
Nouveaux espaces d'escalade au centre sportif de la plaine,Sport
Un café éphémère dans le jardin Herold,Solidarités
Des balises de courses d'orientation dans des parcs du 19e,Sport
Des vidéoprojecteurs interactifs pour l'EP St Benoit,Education et jeunesse
Achat d'un nouveau bus pour l’association les enfants du canal,Solidarités
"Divers aménagements dans le 19e : sécuriser, protéger et ralentir",Mobilités
Sécurisation passage piéton carrefour Ordener Montcalm,Prévention et sécurité
école durable = école plus agréable GS Lamoricière,Cadre de vie
Remplacement des souffleurs de déchets,Propreté
Embellir les murs existants du périphérique avec de nouvelles peintures murales,Propreté
Végétaliser le mur du jardin pédagogique de l'EP Goutte d'Or,Cadre de vie
Rendre la place passage Championnet plus accueillante / pose d’un banc et d’arceaux à vélos,Cadre de vie
01 - Fontaine du Pot de fer,Cadre de vie
/1102/Aménagement locaux et achat matériel médical Emmaüs Rue Bichat,Solidarités
Installation chargeurs téléphones sécurisés,Solidarités
Des sonomètres pour lutter contre le bruit,Environnement
Des équipements techniques et pédagogiques pour Archipélia,Education et jeunesse
Réseaux Franciliens du Réemploi/Invest Mon Pti Pyhton,Solidarités
-Plus de cours Oasis pour les écoles du 20e arrondissement- polyvalente Le Vau,Education et jeunesse
Plus de cours Oasis pour les écoles du 20e arrondissement- polyvalente cité champagne,Education et jeunesse
EM Léon Schwartzbenberg,Environnement
Reliquat: GS Küss,Education et jeunesse
Prolonger la coulée verte quai de Grenelle,Environnement
Equipement de l'accueil de jour dans le local d'Aurore Itinérances,Solidarités
Permettre l'apprentissage du vélo et du code de la route : rénovation du TEP Jenner,Sport
Décoration et aménagement de l'EM Maraichers,Environnement
Végétalisation et aménagement de  l'EP Forest,Education et jeunesse
02-Pour des espaces verts rénovés - Agrès Belleville/Villa Ottoz,Cadre de vie
04-Rénovation du trottoir 91 rue Curial,Cadre de vie
Des cantines moins bruyantes EM Traversière,Education et jeunesse
Atelier de menuiserie et upcycling/ESS/design,Solidarités
Implanter un atelier de bricolage solidaire (Activ 18),Solidarités
Les Grands Moyens Construction,Solidarités
Cour Oasis à l'EM rue du Maroc,Education et jeunesse
Aménagement numérique,Solidarités
Couvrir les deux terrains de sport au square Marcel Sembat,Sport
Bien grandir dans le 11e /  Des jardins comestibles pour les enfants et familles du 11ème/Cours Oasis GS Godefroy Cavaignac,Education et jeunesse
Coup de Pousses,Solidarités
"RepareSeb, aménagement local P. Chapelle",Attractivité et emploi
ArtStock - réemploi de matériaux de la filière culturelle et événementielle,Solidarités
Fondation Apprentis d'Auteil - aménagement de l'entrepôt logistique,Solidarités
CAT Leopold Bellan de la Fondation Bellan - Boutique de réparation de vélo dans le 13°,Attractivité et emploi
Re touchons du bois - Aménagement,Solidarités
La Petite Rockette - Deux nouveaux services écologiques à la Petite Rockette Montgallet,Solidarités
Accès à une alimentation de qualité pour tous !,Solidarités
Restaurer les fresques de la chapelle SaintValère de la basilique SainteClotilde,Culture et patrimoine
Restaurer la fontaine Charlemagne,Culture et patrimoine
Equiper les associations du quartier,Solidarités
Achat de vélos cargos et de matériel,Solidarités
Centre sportif Louis Lumière,Sport
CPA Mathis,Education et jeunesse
Equiper toutes les écoles des quartiers prioritaires du 10e de Tableaux Numériques Interactifs (TNI)/EE Faubourg St Denis,Education et jeunesse
02 - Une ombrière dans l'espace de jeux pour enfants du jardin Truillot,Cadre de vie
Rénover les écoles du 20e / EE Josseaume - Sanitaires,Education et jeunesse
Rénover les écoles du 20e / EM Pelleport - Sanitaires,Education et jeunesse
Matériel sonore à mutualiser pour Septembre Indien,Culture et patrimoine
Rénovation des murs,Culture et patrimoine
Végétalisation école Goutte d'Or,Cadre de vie
Expérimentons un tiers lieu citoyen pour reconnecter les habitants de Bastille-Charonne,Solidarités
Achat de vélos cargo pour les maraudes de l'association ADSF,Solidarités
Installation d'une serre pédagogique dans le groupe scolaire Briançon,Santé
HAWA au féminin - travaux boutique dans le 6e,Propreté
Augmenter l'offre sportive sur le TEP Charlemagne,Sport
Cour de récération école polyvalente Etienne Marcel,Education et jeunesse
Piétonniser et végétaliser la rue du Pélican,Cadre de vie
Aménagement Place de l'Edit de Nantes (angle Crimée Duvergier),Cadre de vie
Cour récréation école maternelle MOUFFETARD,Education et jeunesse
Maraichers,Cadre de vie
La plus belle vue de Paris,Cadre de vie
Végétalisation des pieds d'arbres faubourg Saint-Antoine,Environnement
Un mur végétal rue Lacépède,Cadre de vie
Parcours promenade 16e,Culture et patrimoine
Restauration sculptures jardin Ranelagh,Culture et patrimoine
FRESQUE COLLEGE EDMOND MICHELET,Culture et patrimoine
Aménagement du parvis de l’église Notre-Dame-de-Lorette et de la rue Bourdaloue,Cadre de vie
Réaménagement du coté pair de la rue du Grenier Saint-Lazare,Cadre de vie
Piste Cyclable sur le Boulevard Malesherbes,Mobilités
Boite à dons (Régie de Quartier),Solidarités
Jardin Gandon,Environnement
"52-54, rue Nollet 17e",Environnement
Square du Temple - Kiosque à musique,Cadre de vie
Square Jean XXIII - Kiosque à musique,Cadre de vie
"Square d'Anvers, Kiosque à musique",Cadre de vie
"Square de la Salamandre, Kiosque à musique",Cadre de vie
Favoriser le sport dans les jardins du 17e / sq. des Epinettes,Cadre de vie
